{
  "$schema": "./schemas/parable-match.schema.json",
  "game": "parable-match",
  "version": 1,
  "displayName": "Parable Match",
  "roundsPerSession": 5,
  "sessions": [
    {
      "id": "core-parable-match-001",
      "title": "Parable Match Core Library",
      "theme": "Jesus' parables and their lessons",
      "rounds": [
        {
          "id": "parable-prodigal-son-main",
          "title": "The Prodigal Son (central lesson)",
          "theme": "Repentance and mercy",
          "parableReference": "Luke 15:11-32",
          "parableSummary": "A lost son returns home and is welcomed by his father.",
          "parableTextShort": "This my son was dead, and is alive again.",
          "lessonSummary": "Repentance and mercy is the central lesson Jesus presses through this parable.",
          "lessonTextShort": "The main point calls hearers to respond faithfully.",
          "answerKey": "prodigal-son-main",
          "difficulty": "easy",
          "teachingNote": "This card focuses on the parable's broad, most recognizable lesson. The Prodigal Son is found in Luke 15:11-32."
        },
        {
          "id": "parable-prodigal-son-response",
          "title": "The Prodigal Son (response)",
          "theme": "Repentance and mercy",
          "parableReference": "Luke 15:11-32",
          "parableSummary": "A lost son returns home and is welcomed by his father.",
          "parableTextShort": "This my son was dead, and is alive again.",
          "lessonSummary": "The parable asks hearers to respond with repentance and mercy.",
          "lessonTextShort": "Jesus' story pushes the listener toward a concrete response.",
          "answerKey": "prodigal-son-response",
          "difficulty": "medium",
          "teachingNote": "This card emphasizes how the parable confronts the hearer's response. The Prodigal Son is found in Luke 15:11-32."
        },
        {
          "id": "parable-prodigal-son-warning",
          "title": "The Prodigal Son (warning)",
          "theme": "Repentance and mercy",
          "parableReference": "Luke 15:11-32",
          "parableSummary": "A lost son returns home and is welcomed by his father.",
          "parableTextShort": "This my son was dead, and is alive again.",
          "lessonSummary": "The parable warns against missing repentance and mercy.",
          "lessonTextShort": "The warning lands on those who hear but refuse the lesson.",
          "answerKey": "prodigal-son-warning",
          "difficulty": "medium",
          "teachingNote": "This card highlights the corrective edge of Jesus' teaching. The Prodigal Son is found in Luke 15:11-32."
        },
        {
          "id": "parable-prodigal-son-kingdom",
          "title": "The Prodigal Son (kingdom)",
          "theme": "Repentance and mercy",
          "parableReference": "Luke 15:11-32",
          "parableSummary": "A lost son returns home and is welcomed by his father.",
          "parableTextShort": "This my son was dead, and is alive again.",
          "lessonSummary": "The parable reveals a kingdom pattern connected to repentance and mercy.",
          "lessonTextShort": "The kingdom meaning is seen by tracing the story's reversal, contrast, or image.",
          "answerKey": "prodigal-son-kingdom",
          "difficulty": "hard",
          "teachingNote": "This card asks players to connect the parable to a wider kingdom theme. The Prodigal Son is found in Luke 15:11-32."
        },
        {
          "id": "parable-good-samaritan-main",
          "title": "The Good Samaritan (central lesson)",
          "theme": "Neighbor love",
          "parableReference": "Luke 10:30-37",
          "parableSummary": "A Samaritan shows mercy to a wounded man.",
          "parableTextShort": "He had compassion on him.",
          "lessonSummary": "Neighbor love is the central lesson Jesus presses through this parable.",
          "lessonTextShort": "The main point calls hearers to respond faithfully.",
          "answerKey": "good-samaritan-main",
          "difficulty": "easy",
          "teachingNote": "This card focuses on the parable's broad, most recognizable lesson. The Good Samaritan is found in Luke 10:30-37."
        },
        {
          "id": "parable-good-samaritan-response",
          "title": "The Good Samaritan (response)",
          "theme": "Neighbor love",
          "parableReference": "Luke 10:30-37",
          "parableSummary": "A Samaritan shows mercy to a wounded man.",
          "parableTextShort": "He had compassion on him.",
          "lessonSummary": "The parable asks hearers to respond with neighbor love.",
          "lessonTextShort": "Jesus' story pushes the listener toward a concrete response.",
          "answerKey": "good-samaritan-response",
          "difficulty": "medium",
          "teachingNote": "This card emphasizes how the parable confronts the hearer's response. The Good Samaritan is found in Luke 10:30-37."
        },
        {
          "id": "parable-good-samaritan-warning",
          "title": "The Good Samaritan (warning)",
          "theme": "Neighbor love",
          "parableReference": "Luke 10:30-37",
          "parableSummary": "A Samaritan shows mercy to a wounded man.",
          "parableTextShort": "He had compassion on him.",
          "lessonSummary": "The parable warns against missing neighbor love.",
          "lessonTextShort": "The warning lands on those who hear but refuse the lesson.",
          "answerKey": "good-samaritan-warning",
          "difficulty": "medium",
          "teachingNote": "This card highlights the corrective edge of Jesus' teaching. The Good Samaritan is found in Luke 10:30-37."
        },
        {
          "id": "parable-good-samaritan-kingdom",
          "title": "The Good Samaritan (kingdom)",
          "theme": "Neighbor love",
          "parableReference": "Luke 10:30-37",
          "parableSummary": "A Samaritan shows mercy to a wounded man.",
          "parableTextShort": "He had compassion on him.",
          "lessonSummary": "The parable reveals a kingdom pattern connected to neighbor love.",
          "lessonTextShort": "The kingdom meaning is seen by tracing the story's reversal, contrast, or image.",
          "answerKey": "good-samaritan-kingdom",
          "difficulty": "hard",
          "teachingNote": "This card asks players to connect the parable to a wider kingdom theme. The Good Samaritan is found in Luke 10:30-37."
        },
        {
          "id": "parable-sower-main",
          "title": "The Sower (central lesson)",
          "theme": "Receiving the word",
          "parableReference": "Matthew 13:3-23",
          "parableSummary": "Seed falls on different soils with different outcomes.",
          "parableTextShort": "Some fell into good ground, and brought forth fruit.",
          "lessonSummary": "Receiving the word is the central lesson Jesus presses through this parable.",
          "lessonTextShort": "The main point calls hearers to respond faithfully.",
          "answerKey": "sower-main",
          "difficulty": "easy",
          "teachingNote": "This card focuses on the parable's broad, most recognizable lesson. The Sower is found in Matthew 13:3-23."
        },
        {
          "id": "parable-sower-response",
          "title": "The Sower (response)",
          "theme": "Receiving the word",
          "parableReference": "Matthew 13:3-23",
          "parableSummary": "Seed falls on different soils with different outcomes.",
          "parableTextShort": "Some fell into good ground, and brought forth fruit.",
          "lessonSummary": "The parable asks hearers to respond with receiving the word.",
          "lessonTextShort": "Jesus' story pushes the listener toward a concrete response.",
          "answerKey": "sower-response",
          "difficulty": "medium",
          "teachingNote": "This card emphasizes how the parable confronts the hearer's response. The Sower is found in Matthew 13:3-23."
        },
        {
          "id": "parable-sower-warning",
          "title": "The Sower (warning)",
          "theme": "Receiving the word",
          "parableReference": "Matthew 13:3-23",
          "parableSummary": "Seed falls on different soils with different outcomes.",
          "parableTextShort": "Some fell into good ground, and brought forth fruit.",
          "lessonSummary": "The parable warns against missing receiving the word.",
          "lessonTextShort": "The warning lands on those who hear but refuse the lesson.",
          "answerKey": "sower-warning",
          "difficulty": "medium",
          "teachingNote": "This card highlights the corrective edge of Jesus' teaching. The Sower is found in Matthew 13:3-23."
        },
        {
          "id": "parable-sower-kingdom",
          "title": "The Sower (kingdom)",
          "theme": "Receiving the word",
          "parableReference": "Matthew 13:3-23",
          "parableSummary": "Seed falls on different soils with different outcomes.",
          "parableTextShort": "Some fell into good ground, and brought forth fruit.",
          "lessonSummary": "The parable reveals a kingdom pattern connected to receiving the word.",
          "lessonTextShort": "The kingdom meaning is seen by tracing the story's reversal, contrast, or image.",
          "answerKey": "sower-kingdom",
          "difficulty": "hard",
          "teachingNote": "This card asks players to connect the parable to a wider kingdom theme. The Sower is found in Matthew 13:3-23."
        },
        {
          "id": "parable-lost-sheep-main",
          "title": "The Lost Sheep (central lesson)",
          "theme": "Seeking the lost",
          "parableReference": "Luke 15:3-7",
          "parableSummary": "A shepherd searches for one lost sheep.",
          "parableTextShort": "He goeth after that which is lost, until he find it.",
          "lessonSummary": "Seeking the lost is the central lesson Jesus presses through this parable.",